{
  "$schema":"https://json-schema.org/draft/2020-12/schema",
  "$id":"https://mobile-ui-generator.dev/schema/verification-profiles-1.0.0.json",
  "type":"object","additionalProperties":false,"required":["schema_version","registry_version","dimensions_contract","profiles"],
  "properties":{"schema_version":{"const":"1.0.0"},"registry_version":{"type":"string","minLength":1},"dimensions_contract":{"type":"object","additionalProperties":false,"required":["viewport_units","capture_units","capture_rule"],"properties":{"viewport_units":{"const":"logical_css_or_points"},"capture_units":{"const":"physical_pixels"},"capture_rule":{"const":"capture.width = viewport.width * pixel_ratio and capture.height = viewport.height * pixel_ratio"}}},"profiles":{"type":"array","minItems":21,"items":{"$ref":"#/$defs/profile"}}},
  "$defs":{
    "number":{"type":"number","minimum":0},
    "insets":{"type":"object","additionalProperties":false,"required":["top","right","bottom","left","unit"],"properties":{"top":{"$ref":"#/$defs/number"},"right":{"$ref":"#/$defs/number"},"bottom":{"$ref":"#/$defs/number"},"left":{"$ref":"#/$defs/number"},"unit":{"const":"px"}}},
    "profile":{"type":"object","additionalProperties":false,"required":["profile_id","platform","profile","os","os_version","viewport","pixel_ratio","safe_area","orientation","theme","locale","text_scale_multiplier","keyboard","capture","toolchain"],"properties":{"profile_id":{"type":"string","pattern":"^(web|ios|android)-(compact|standard|large|dark|short-keyboard|large-text|long-copy-ko|long-copy-en)$"},"platform":{"enum":["web","ios","android"]},"profile":{"enum":["compact","standard","large","dark","short-keyboard","large-text","long-copy-ko","long-copy-en"]},"os":{"type":"string","minLength":1},"os_version":{"type":"string","minLength":1},"browser":{"type":"string","minLength":1},"browser_version":{"type":"string","minLength":1},"device_name":{"type":"string","minLength":1},"simulator_udid":{"type":"string","pattern":"^[A-Fa-f0-9-]{36}$"},"api_level":{"type":"integer","minimum":1},"avd_name":{"type":"string","minLength":1},"viewport":{"type":"object","additionalProperties":false,"required":["width","height"],"properties":{"width":{"type":"integer","minimum":1},"height":{"type":"integer","minimum":1}}},"pixel_ratio":{"type":"number","exclusiveMinimum":0},"safe_area":{"$ref":"#/$defs/insets"},"orientation":{"const":"portrait"},"theme":{"enum":["light","dark"]},"locale":{"type":"string","pattern":"^[a-z]{2}-[A-Z]{2}$"},"text_scale_multiplier":{"type":"number","minimum":1,"maximum":3},"keyboard":{"type":"object","additionalProperties":false,"required":["open","height","bottom_inset"],"properties":{"open":{"type":"boolean"},"height":{"type":"number","minimum":0},"bottom_inset":{"type":"number","minimum":0}}},"capture":{"type":"object","additionalProperties":false,"required":["width","height","orientation"],"properties":{"width":{"type":"integer","minimum":1},"height":{"type":"integer","minimum":1},"orientation":{"const":"portrait"}}},"toolchain":{"type":"object","additionalProperties":false,"required":["name","version"],"properties":{"name":{"type":"string","minLength":1},"version":{"type":"string","minLength":1}}}}}
  }
}
