{
  "schema_version": "1.0.0",
  "registry_version": "verification-profiles-2026-07-11-v1",
  "dimensions_contract": {"viewport_units":"logical_css_or_points","capture_units":"physical_pixels","capture_rule":"capture.width = viewport.width * pixel_ratio and capture.height = viewport.height * pixel_ratio"},
  "profiles": [
    {"profile_id":"web-compact","platform":"web","profile":"compact","os":"Chromium","os_version":"128.0.6613.0","browser":"Chromium","browser_version":"128.0.6613.0","viewport":{"width":320,"height":568},"pixel_ratio":1,"safe_area":{"top":0,"right":0,"bottom":0,"left":0,"unit":"px"},"orientation":"portrait","theme":"light","locale":"ko-KR","text_scale_multiplier":1,"keyboard":{"open":false,"height":0,"bottom_inset":0},"capture":{"width":320,"height":568,"orientation":"portrait"},"toolchain":{"name":"playwright","version":"1.49.1"}},
    {"profile_id":"web-standard","platform":"web","profile":"standard","os":"Chromium","os_version":"128.0.6613.0","browser":"Chromium","browser_version":"128.0.6613.0","viewport":{"width":390,"height":844},"pixel_ratio":1,"safe_area":{"top":0,"right":0,"bottom":0,"left":0,"unit":"px"},"orientation":"portrait","theme":"light","locale":"ko-KR","text_scale_multiplier":1,"keyboard":{"open":false,"height":0,"bottom_inset":0},"capture":{"width":390,"height":844,"orientation":"portrait"},"toolchain":{"name":"playwright","version":"1.49.1"}},
    {"profile_id":"web-dark","platform":"web","profile":"dark","os":"Chromium","os_version":"128.0.6613.0","browser":"Chromium","browser_version":"128.0.6613.0","viewport":{"width":390,"height":844},"pixel_ratio":1,"safe_area":{"top":0,"right":0,"bottom":0,"left":0,"unit":"px"},"orientation":"portrait","theme":"dark","locale":"ko-KR","text_scale_multiplier":1,"keyboard":{"open":false,"height":0,"bottom_inset":0},"capture":{"width":390,"height":844,"orientation":"portrait"},"toolchain":{"name":"playwright","version":"1.49.1"}},
    {"profile_id":"web-large","platform":"web","profile":"large","os":"Chromium","os_version":"128.0.6613.0","browser":"Chromium","browser_version":"128.0.6613.0","viewport":{"width":430,"height":932},"pixel_ratio":1,"safe_area":{"top":0,"right":0,"bottom":0,"left":0,"unit":"px"},"orientation":"portrait","theme":"light","locale":"ko-KR","text_scale_multiplier":1,"keyboard":{"open":false,"height":0,"bottom_inset":0},"capture":{"width":430,"height":932,"orientation":"portrait"},"toolchain":{"name":"playwright","version":"1.49.1"}},
    {"profile_id":"web-short-keyboard","platform":"web","profile":"short-keyboard","os":"Chromium","os_version":"128.0.6613.0","browser":"Chromium","browser_version":"128.0.6613.0","viewport":{"width":390,"height":667},"pixel_ratio":1,"safe_area":{"top":0,"right":0,"bottom":0,"left":0,"unit":"px"},"orientation":"portrait","theme":"light","locale":"ko-KR","text_scale_multiplier":1,"keyboard":{"open":true,"height":291,"bottom_inset":291},"capture":{"width":390,"height":667,"orientation":"portrait"},"toolchain":{"name":"playwright","version":"1.49.1"}},
    {"profile_id":"web-large-text","platform":"web","profile":"large-text","os":"Chromium","os_version":"128.0.6613.0","browser":"Chromium","browser_version":"128.0.6613.0","viewport":{"width":390,"height":844},"pixel_ratio":1,"safe_area":{"top":0,"right":0,"bottom":0,"left":0,"unit":"px"},"orientation":"portrait","theme":"light","locale":"ko-KR","text_scale_multiplier":1.3,"keyboard":{"open":false,"height":0,"bottom_inset":0},"capture":{"width":390,"height":844,"orientation":"portrait"},"toolchain":{"name":"playwright","version":"1.49.1"}},
    {"profile_id":"web-long-copy-ko","platform":"web","profile":"long-copy-ko","os":"Chromium","os_version":"128.0.6613.0","browser":"Chromium","browser_version":"128.0.6613.0","viewport":{"width":390,"height":844},"pixel_ratio":1,"safe_area":{"top":0,"right":0,"bottom":0,"left":0,"unit":"px"},"orientation":"portrait","theme":"light","locale":"ko-KR","text_scale_multiplier":1,"keyboard":{"open":false,"height":0,"bottom_inset":0},"capture":{"width":390,"height":844,"orientation":"portrait"},"toolchain":{"name":"playwright","version":"1.49.1"}},
    {"profile_id":"web-long-copy-en","platform":"web","profile":"long-copy-en","os":"Chromium","os_version":"128.0.6613.0","browser":"Chromium","browser_version":"128.0.6613.0","viewport":{"width":390,"height":844},"pixel_ratio":1,"safe_area":{"top":0,"right":0,"bottom":0,"left":0,"unit":"px"},"orientation":"portrait","theme":"light","locale":"en-US","text_scale_multiplier":1,"keyboard":{"open":false,"height":0,"bottom_inset":0},"capture":{"width":390,"height":844,"orientation":"portrait"},"toolchain":{"name":"playwright","version":"1.49.1"}},
    {"profile_id":"ios-compact","platform":"ios","profile":"compact","os":"iOS","os_version":"17.2","device_name":"iPhone 15","simulator_udid":"7732B728-22A6-4CCC-A121-C1F2BDC5EC23","viewport":{"width":320,"height":568},"pixel_ratio":3,"safe_area":{"top":59,"right":0,"bottom":34,"left":0,"unit":"px"},"orientation":"portrait","theme":"light","locale":"ko-KR","text_scale_multiplier":1,"keyboard":{"open":false,"height":0,"bottom_inset":34},"capture":{"width":960,"height":1704,"orientation":"portrait"},"toolchain":{"name":"Xcode","version":"15.2"}},
    {"profile_id":"ios-standard","platform":"ios","profile":"standard","os":"iOS","os_version":"17.2","device_name":"iPhone 15","simulator_udid":"7732B728-22A6-4CCC-A121-C1F2BDC5EC23","viewport":{"width":390,"height":844},"pixel_ratio":3,"safe_area":{"top":59,"right":0,"bottom":34,"left":0,"unit":"px"},"orientation":"portrait","theme":"light","locale":"ko-KR","text_scale_multiplier":1,"keyboard":{"open":false,"height":0,"bottom_inset":34},"capture":{"width":1170,"height":2532,"orientation":"portrait"},"toolchain":{"name":"Xcode","version":"15.2"}},
    {"profile_id":"ios-dark","platform":"ios","profile":"dark","os":"iOS","os_version":"17.2","device_name":"iPhone 15","simulator_udid":"7732B728-22A6-4CCC-A121-C1F2BDC5EC23","viewport":{"width":390,"height":844},"pixel_ratio":3,"safe_area":{"top":59,"right":0,"bottom":34,"left":0,"unit":"px"},"orientation":"portrait","theme":"dark","locale":"ko-KR","text_scale_multiplier":1,"keyboard":{"open":false,"height":0,"bottom_inset":34},"capture":{"width":1170,"height":2532,"orientation":"portrait"},"toolchain":{"name":"Xcode","version":"15.2"}},
    {"profile_id":"ios-large","platform":"ios","profile":"large","os":"iOS","os_version":"17.2","device_name":"iPhone 15","simulator_udid":"7732B728-22A6-4CCC-A121-C1F2BDC5EC23","viewport":{"width":430,"height":932},"pixel_ratio":3,"safe_area":{"top":59,"right":0,"bottom":34,"left":0,"unit":"px"},"orientation":"portrait","theme":"light","locale":"ko-KR","text_scale_multiplier":1,"keyboard":{"open":false,"height":0,"bottom_inset":34},"capture":{"width":1290,"height":2796,"orientation":"portrait"},"toolchain":{"name":"Xcode","version":"15.2"}},
    {"profile_id":"ios-short-keyboard","platform":"ios","profile":"short-keyboard","os":"iOS","os_version":"17.2","device_name":"iPhone 15","simulator_udid":"7732B728-22A6-4CCC-A121-C1F2BDC5EC23","viewport":{"width":390,"height":667},"pixel_ratio":3,"safe_area":{"top":59,"right":0,"bottom":34,"left":0,"unit":"px"},"orientation":"portrait","theme":"light","locale":"ko-KR","text_scale_multiplier":1,"keyboard":{"open":true,"height":291,"bottom_inset":325},"capture":{"width":1170,"height":2001,"orientation":"portrait"},"toolchain":{"name":"Xcode","version":"15.2"}},
    {"profile_id":"ios-large-text","platform":"ios","profile":"large-text","os":"iOS","os_version":"17.2","device_name":"iPhone 15","simulator_udid":"7732B728-22A6-4CCC-A121-C1F2BDC5EC23","viewport":{"width":390,"height":844},"pixel_ratio":3,"safe_area":{"top":59,"right":0,"bottom":34,"left":0,"unit":"px"},"orientation":"portrait","theme":"light","locale":"ko-KR","text_scale_multiplier":1.3,"keyboard":{"open":false,"height":0,"bottom_inset":34},"capture":{"width":1170,"height":2532,"orientation":"portrait"},"toolchain":{"name":"Xcode","version":"15.2"}},
    {"profile_id":"ios-long-copy-ko","platform":"ios","profile":"long-copy-ko","os":"iOS","os_version":"17.2","device_name":"iPhone 15","simulator_udid":"7732B728-22A6-4CCC-A121-C1F2BDC5EC23","viewport":{"width":390,"height":844},"pixel_ratio":3,"safe_area":{"top":59,"right":0,"bottom":34,"left":0,"unit":"px"},"orientation":"portrait","theme":"light","locale":"ko-KR","text_scale_multiplier":1,"keyboard":{"open":false,"height":0,"bottom_inset":34},"capture":{"width":1170,"height":2532,"orientation":"portrait"},"toolchain":{"name":"Xcode","version":"15.2"}},
    {"profile_id":"ios-long-copy-en","platform":"ios","profile":"long-copy-en","os":"iOS","os_version":"17.2","device_name":"iPhone 15","simulator_udid":"7732B728-22A6-4CCC-A121-C1F2BDC5EC23","viewport":{"width":390,"height":844},"pixel_ratio":3,"safe_area":{"top":59,"right":0,"bottom":34,"left":0,"unit":"px"},"orientation":"portrait","theme":"light","locale":"en-US","text_scale_multiplier":1,"keyboard":{"open":false,"height":0,"bottom_inset":34},"capture":{"width":1170,"height":2532,"orientation":"portrait"},"toolchain":{"name":"Xcode","version":"15.2"}},
    {"profile_id":"android-compact","platform":"android","profile":"compact","os":"Android","os_version":"14","api_level":34,"device_name":"Pixel 7","avd_name":"mobile_ui_api34","viewport":{"width":320,"height":568},"pixel_ratio":1,"safe_area":{"top":24,"right":0,"bottom":24,"left":0,"unit":"px"},"orientation":"portrait","theme":"light","locale":"ko-KR","text_scale_multiplier":1,"keyboard":{"open":false,"height":0,"bottom_inset":24},"capture":{"width":320,"height":568,"orientation":"portrait"},"toolchain":{"name":"Android SDK","version":"35.0.2"}},